{
  "$schema": "../../schemas/evals/routing-cases.schema.json",
  "type": "ROUTING_CASE_SET",
  "schemaVersion": 2,
  "name": "tooling-redesign-workflows",
  "description": "Unobserved acceptance definitions for the first catalog redesign slice.",
  "cases": [
    {
      "id": "developer-tooling-keeps-personal-effects-explicit",
      "type": "COVERAGE_GAP",
      "source": {
        "type": "CURRENT_SOURCE",
        "capturedAt": "2026-10-12",
        "evidenceRefs": [
          "source/plugins/developer-tooling/plugin.json",
          "source/MIGRATION.md"
        ]
      },
      "prompt": "Audit Developer Tooling. Prove its tool and configuration procedures remain task-selected and install no automatic hooks or MCP connections.",
      "expectedPrimitive": {
        "type": "PLUGIN",
        "name": "developer-tooling"
      },
      "observedRoute": {
        "type": "ROUTING_ROUTE_OBSERVATION",
        "summary": "Unobserved redesign acceptance scenario.",
        "risk": "Installing a workflow also selects unrelated personal or automatic behavior.",
        "loadedPrimitives": []
      },
      "allowedActions": [
        "Resolve each canonical skill and agent reference in Developer Tooling.",
        "Keep personal configuration changes subject to the requested task scope."
      ],
      "forbiddenActions": [
        "Patch generated provider output by hand.",
        "Change installed caches or live personal configuration.",
        "Treat static composition checks as observed model routing or useful outcomes."
      ],
      "recoveryExpectation": "Reject unproven or overlapping hook selection and report missing host evidence.",
      "productiveOutcome": "A coherent package selection preserves the stated workflow and effect boundary.",
      "verificationEvidence": [
        "The source graph and focused composition checks pass.",
        "The package closure has no hooks or MCP declaration."
      ],
      "notes": "Designed obligation only; no model routing or host execution observation is claimed."
    },
    {
      "id": "personal-configuration-keeps-authoring-outside",
      "type": "COVERAGE_GAP",
      "source": {
        "type": "CURRENT_SOURCE",
        "capturedAt": "2026-10-12",
        "evidenceRefs": [
          "source/plugins/developer-tooling/plugin.json",
          "source/MIGRATION.md"
        ]
      },
      "prompt": "Audit the personal configuration procedure in Developer Tooling. Prove that unrelated agent authoring stays idle and that no automatic hook changes personal state.",
      "expectedPrimitive": {
        "type": "PLUGIN",
        "name": "developer-tooling"
      },
      "observedRoute": {
        "type": "ROUTING_ROUTE_OBSERVATION",
        "summary": "Unobserved redesign acceptance scenario.",
        "risk": "Installing a workflow also selects unrelated personal or automatic behavior.",
        "loadedPrimitives": []
      },
      "allowedActions": [
        "Resolve personal setup and CLI procedures from canonical source.",
        "Keep unrelated authoring procedures idle for a personal configuration task."
      ],
      "forbiddenActions": [
        "Patch generated provider output by hand.",
        "Change installed caches or live personal configuration.",
        "Treat static composition checks as observed model routing or useful outcomes."
      ],
      "recoveryExpectation": "Reject unproven or overlapping hook selection and report missing host evidence.",
      "productiveOutcome": "A coherent package selection preserves the stated workflow and effect boundary.",
      "verificationEvidence": [
        "The source graph and focused composition checks pass.",
        "The closure includes personal setup management and has no hooks."
      ],
      "notes": "Designed obligation only; no model routing or host execution observation is claimed."
    },
    {
      "id": "source-check-integration-needs-no-authoring-skill",
      "type": "COVERAGE_GAP",
      "source": {
        "type": "CURRENT_SOURCE",
        "capturedAt": "2026-10-12",
        "evidenceRefs": [
          "source/hooks/source-graph-valid.hook.json",
          "docs/workflow-resources.md"
        ]
      },
      "prompt": "Audit the standalone source-graph hook. Prove a disposable custom composition carries the runtime without unrelated authoring skills.",
      "expectedPrimitive": {
        "type": "HOOK",
        "name": "source-graph-valid"
      },
      "observedRoute": {
        "type": "ROUTING_ROUTE_OBSERVATION",
        "summary": "Unobserved redesign acceptance scenario.",
        "risk": "Installing a workflow also selects unrelated personal or automatic behavior.",
        "loadedPrimitives": []
      },
      "allowedActions": [
        "Compose the source hook explicitly in one disposable test bundle.",
        "Preserve the source validator and Stop output adapter."
      ],
      "forbiddenActions": [
        "Patch generated provider output by hand.",
        "Change installed caches or live personal configuration.",
        "Treat static composition checks as observed model routing or useful outcomes."
      ],
      "recoveryExpectation": "Reject unproven or overlapping hook selection and report missing host evidence.",
      "productiveOutcome": "A coherent package selection preserves the stated workflow and effect boundary.",
      "verificationEvidence": [
        "The source graph and focused composition checks pass.",
        "The integration closure contains the hook and no skill dependencies."
      ],
      "notes": "Designed obligation only; no model routing or host execution observation is claimed."
    }
  ]
}
