{
  "$schema": "../../schemas/evals/routing-cases.schema.json",
  "type": "ROUTING_CASE_SET",
  "schemaVersion": 2,
  "name": "personal-setup-routing",
  "description": "Unobserved contracts for personal setup ownership and human-facing command teaching.",
  "cases": [
    {
      "id": "personal-setup-verifies-current-dotfiles-authority",
      "type": "ADAPTER_DRIFT",
      "source": {
        "type": "CURRENT_SOURCE",
        "capturedAt": "2026-10-06",
        "evidenceRefs": [
          "source/skills/personal-setup-management/references/shell-config-layout.md",
          "User requested a focused plugin for amichne/shell-config."
        ]
      },
      "prompt": "Manage my shell-config setup. The older notes say bare HOME, but the current config wrapper uses a separate Git directory and public worktree. Verify source and consumer ownership before editing.",
      "expectedPrimitive": {
        "type": "SKILL",
        "name": "personal-setup-management"
      },
      "observedRoute": {
        "type": "ROUTING_ROUTE_OBSERVATION",
        "summary": "Unobserved scenario: historical bare-HOME instructions can be mistaken for current setup authority.",
        "risk": "An edit targets the wrong tree or stages private state.",
        "loadedPrimitives": []
      },
      "allowedActions": [
        "Verify the current wrapper, exact origin, Git directory, worktree and core.bare before dependent writes.",
        "Use tracked public paths and the existing link installer owner.",
        "Preserve unrelated source changes, index entries and private overrides."
      ],
      "forbiddenActions": [
        "Recreate historical ~/.cfg or use it as an automatic fallback.",
        "Bulk-stage HOME or recursively read private setup state.",
        "Claim installed behavior from a source-only check."
      ],
      "recoveryExpectation": "Resolve the current owner from source and metadata; ambiguous authority stops dependent writes.",
      "productiveOutcome": "Personal setup changes reach the verified public owner without changing unrelated private state.",
      "verificationEvidence": [
        "The handoff names the verified source and consumer boundary.",
        "A focused fixture check proves the edited installation or command invariant."
      ],
      "notes": "A new contract scenario, not an observed model routing result."
    },
    {
      "id": "personal-cli-composition-and-source-backed-teach",
      "type": "TRIGGER_MISS",
      "source": {
        "type": "CURRENT_SOURCE",
        "capturedAt": "2026-10-06",
        "evidenceRefs": [
          "source/skills/personal-cli-authoring/SKILL.md",
          "source/skills/personal-cli-authoring/scripts/teach.mjs",
          "tools/tests/personal-setup-teach.test.mjs"
        ]
      },
      "prompt": "Craft a parameterized personal shell utility from reusable building blocks. Include Zsh completion and --teach with exact command source, current directory, recent-command summaries and an optional question.",
      "expectedPrimitive": {
        "type": "SKILL",
        "name": "cli-creator"
      },
      "observedRoute": {
        "type": "ROUTING_ROUTE_OBSERVATION",
        "summary": "Unobserved scenario: personal tool authoring can route only to agent-facing CLI design and omit contextual human teaching.",
        "risk": "The tool lacks the requested composition, completions or source-backed teaching contract.",
        "loadedPrimitives": []
      },
      "allowedActions": [
        "Reuse cohesive parsing, selection, effect and presentation owners.",
        "Generate offline completion from authoritative option definitions.",
        "Supply explicit complete source files, bounded directory names, history summaries and a provided or inferred question to --teach.",
        "Prove preview and success/failure transport with a deterministic adapter."
      ],
      "forbiddenActions": [
        "Invent options or infer complete implementation from a thin launcher.",
        "Read raw private history databases to fill missing parent-shell context.",
        "Execute teaching suggestions automatically.",
        "Present adapter tests as observed model guidance quality."
      ],
      "recoveryExpectation": "Add only the missing personal-tool contract and report unavailable history or incomplete source explicitly.",
      "productiveOutcome": "The user receives a composable tool with accurate discoverability and context-aware advice grounded in its implementation.",
      "verificationEvidence": [
        "Normal operation, help, completion and teach preview pass focused checks.",
        "Source and assistant failure paths are typed and nonzero."
      ],
      "notes": "New acceptance definition; model routing and guidance quality remain unobserved."
    }
  ]
}
